{"schema":"agent-memory-ga-approval-export-manifest-v1","export_id":"ga-approval-export-2026q4","gate":"ga","exported_at":"2026-11-14T02:00:00Z","files":[{"name":"product.json","sha256":"aaaaaaaaaaaaaaaaaaaaaaaaaaaaaaaaaaaaaaaaaaaaaaaaaaaaaaaaaaaaaaaa"},{"name":"security.json","sha256":"bbbbbbbbbbbbbbbbbbbbbbbbbbbbbbbbbbbbbbbbbbbbbbbbbbbbbbbbbbbbbbbb"},{"name":"privacy.json","sha256":"cccccccccccccccccccccccccccccccccccccccccccccccccccccccccccccccc"},{"name":"legal.json","sha256":"dddddddddddddddddddddddddddddddddddddddddddddddddddddddddddddddd"},{"name":"operations.json","sha256":"eeeeeeeeeeeeeeeeeeeeeeeeeeeeeeeeeeeeeeeeeeeeeeeeeeeeeeeeeeeeeeee"}]}
